post_text,time,likes,shares,comments,src,fake_status,last_word,finalized,words,avg_word_length,urgent_words,post_text_tokens,final_words,stop_words,marks,exclamation_marks,Cluster
"станишев и местан - председателите на двете парламентарни групи на мнозинството, предложиха пеевски за шеф на данс. след това всички мрънкаха, извиваха се - и те, и премиерът орешарски и всички политически мъже. човек не трябва да поема чужда вина. използвах сарказъм, но очевидно е бил неуместен и ми се задава 7 години по-късно същият въпрос. сгреших - и със сарказма, и с това, че го подкрепих.",8/1/2021 20:45,631,73,57,frognews.bg,0,подкрепих.,True,67,4.940298507,0,"['станишев', 'и', 'местан', '-', 'председателите', 'на', 'двете', 'парламентарни', 'групи', 'на', 'мнозинството', ',', 'предложиха', 'пеевски', 'за', 'шеф', 'на', 'данс', '.', 'след', 'това', 'всички', 'мрънкаха', ',', 'извиваха', 'се', '-', 'и', 'те', ',', 'и', 'премиерът', 'орешарски', 'и', 'всички', 'политически', 'мъже', '.', 'човек', 'не', 'трябва', 'да', 'поема', 'чужда', 'вина', '.', 'използвах', 'сарказъм', ',', 'но', 'очевидно', 'е', 'бил', 'неуместен', 'и', 'ми', 'се', 'задава', '7', 'години', 'по-късно', 'същият', 'въпрос', '.', 'сгреших', '-', 'и', 'със', 'сарказма', ',', 'и', 'с', 'това', ',', 'че', 'го', 'подкрепих', '.']","['станишев', 'и', 'местан', 'председателите', 'на', 'двете', 'парламентарни', 'групи', 'на', 'мнозинството', 'предложиха', 'пеевски', 'за', 'шеф', 'на', 'данс', 'след', 'това', 'всички', 'мрънкаха', 'извиваха', 'се', 'и', 'те', 'и', 'премиерът', 'орешарски', 'и', 'всички', 'политически', 'мъже', 'човек', 'не', 'трябва', 'да', 'поема', 'чужда', 'вина', 'използвах', 'сарказъм', 'но', 'очевидно', 'е', 'бил', 'неуместен', 'и', 'ми', 'се', 'задава', '7', 'години', 'покъсно', 'същият', 'въпрос', 'сгреших', 'и', 'със', 'сарказма', 'и', 'с', 'това', 'че', 'го', 'подкрепих']",32,15,0,0
"от бойко борисов научих следното: „без пеевски нищо не можеш да правиш в тази държава, знаеш кой владее съдебната система“. г-н борисов, българското общество е време да разбере, че пеевски е „смокиновият лист“, с който прикривате безобразията на ненаситното ви его. това написа днес в отворено писмо съпругата на шефа на вкс лозан панов - елисавета. ето целият текст:",8/1/2021 15:31,2686,568,94,frognews.bg,0,текст:,True,59,5.237288136,0,"['от', 'бойко', 'борисов', 'научих', 'следното', ':', '„', 'без', 'пеевски', 'нищо', 'не', 'можеш', 'да', 'правиш', 'в', 'тази', 'държава', ',', 'знаеш', 'кой', 'владее', 'съдебната', 'система', '“', '.', 'г-н', 'борисов', ',', 'българското', 'общество', 'е', 'време', 'да', 'разбере', ',', 'че', 'пеевски', 'е', '„', 'смокиновият', 'лист', '“', ',', 'с', 'който', 'прикривате', 'безобразията', 'на', 'ненаситното', 'ви', 'его', '.', 'това', 'написа', 'днес', 'в', 'отворено', 'писмо', 'съпругата', 'на', 'шефа', 'на', 'вкс', 'лозан', 'панов', '-', 'елисавета', '.', 'ето', 'целият', 'текст', ':']","['от', 'бойко', 'борисов', 'научих', 'следното', '', 'без', 'пеевски', 'нищо', 'не', 'можеш', 'да', 'правиш', 'в', 'тази', 'държава', 'знаеш', 'кой', 'владее', 'съдебната', 'система', '', 'гн', 'борисов', 'българското', 'общество', 'е', 'време', 'да', 'разбере', 'че', 'пеевски', 'е', '', 'смокиновият', 'лист', '', 'с', 'който', 'прикривате', 'безобразията', 'на', 'ненаситното', 'ви', 'его', 'това', 'написа', 'днес', 'в', 'отворено', 'писмо', 'съпругата', 'на', 'шефа', 'на', 'вкс', 'лозан', 'панов', 'елисавета', 'ето', 'целият', 'текст']",23,11,0,0
"доналд тръмп е нарушил 250-годишното споразумение на кралския политически елит и техните банки. началото е положено през 1760 година от банковата империя на ротшилд. оттогава се счита, че работи и властва световното правителство. тръмп е нарушил поне няколко от основните правила на властелините – никога срещу конституцията, никога срещу институциите, никога срещу гражданите и пр.",8/1/2021 13:06,1422,929,97,frognews.bg,0,пр.,True,55,5.963636364,0,"['доналд', 'тръмп', 'е', 'нарушил', '250-годишното', 'споразумение', 'на', 'кралския', 'политически', 'елит', 'и', 'техните', 'банки', '.', 'началото', 'е', 'положено', 'през', '1760', 'година', 'от', 'банковата', 'империя', 'на', 'ротшилд', '.', 'оттогава', 'се', 'счита', ',', 'че', 'работи', 'и', 'властва', 'световното', 'правителство', '.', 'тръмп', 'е', 'нарушил', 'поне', 'няколко', 'от', 'основните', 'правила', 'на', 'властелините', '–', 'никога', 'срещу', 'конституцията', ',', 'никога', 'срещу', 'институциите', ',', 'никога', 'срещу', 'гражданите', 'и', 'пр', '.']","['доналд', 'тръмп', 'е', 'нарушил', '250годишното', 'споразумение', 'на', 'кралския', 'политически', 'елит', 'и', 'техните', 'банки', 'началото', 'е', 'положено', 'през', '1760', 'година', 'от', 'банковата', 'империя', 'на', 'ротшилд', 'оттогава', 'се', 'счита', 'че', 'работи', 'и', 'властва', 'световното', 'правителство', 'тръмп', 'е', 'нарушил', 'поне', 'няколко', 'от', 'основните', 'правила', 'на', 'властелините', '', 'никога', 'срещу', 'конституцията', 'никога', 'срещу', 'институциите', 'никога', 'срещу', 'гражданите', 'и', 'пр']",20,8,0,0
"герб събра изключителен ресурс. събра го, щавейки бизнеса в продължение на 15 години. това е огромен финансов ресурс. срещу него не може да се изправи някой, който с гуменки да се надбягва с допингиран състезател. някои сме с гуменки, други са с леко по-добри обувки, но съотношението във финансовите възможности на герб и останалите е драстично.",7/1/2021 19:39,634,99,28,frognews.bg,0,драстично.,True,56,5.196428571,0,"['герб', 'събра', 'изключителен', 'ресурс', '.', 'събра', 'го', ',', 'щавейки', 'бизнеса', 'в', 'продължение', 'на', '15', 'години', '.', 'това', 'е', 'огромен', 'финансов', 'ресурс', '.', 'срещу', 'него', 'не', 'може', 'да', 'се', 'изправи', 'някой', ',', 'който', 'с', 'гуменки', 'да', 'се', 'надбягва', 'с', 'допингиран', 'състезател', '.', 'някои', 'сме', 'с', 'гуменки', ',', 'други', 'са', 'с', 'леко', 'по-добри', 'обувки', ',', 'но', 'съотношението', 'във', 'финансовите', 'възможности', 'на', 'герб', 'и', 'останалите', 'е', 'драстично', '.']","['герб', 'събра', 'изключителен', 'ресурс', 'събра', 'го', 'щавейки', 'бизнеса', 'в', 'продължение', 'на', '15', 'години', 'това', 'е', 'огромен', 'финансов', 'ресурс', 'срещу', 'него', 'не', 'може', 'да', 'се', 'изправи', 'някой', 'който', 'с', 'гуменки', 'да', 'се', 'надбягва', 'с', 'допингиран', 'състезател', 'някои', 'сме', 'с', 'гуменки', 'други', 'са', 'с', 'леко', 'подобри', 'обувки', 'но', 'съотношението', 'във', 'финансовите', 'възможности', 'на', 'герб', 'и', 'останалите', 'е', 'драстично']",29,10,0,0
"логично е партията на г-н пеевски /дпс/ да подкрепи борисов за президентските изори. те са както знаете ортаци в бизнеса и политиката. още повече г-н борисов е довереното лице на турския президент ердоган, който поздрави конференцията на дпс. но аз мисля, че избирателите на дпс са свободни български граждани. сигурно ще се замислят за какво отиват гласовете им. това каза президентът румен радев пред журналисти.",6/1/2021 12:08,2824,112,183,frognews.bg,0,журналисти.,True,65,5.384615385,0,"['логично', 'е', 'партията', 'на', 'г-н', 'пеевски', '/дпс/', 'да', 'подкрепи', 'борисов', 'за', 'президентските', 'изори', '.', 'те', 'са', 'както', 'знаете', 'ортаци', 'в', 'бизнеса', 'и', 'политиката', '.', 'още', 'повече', 'г-н', 'борисов', 'е', 'довереното', 'лице', 'на', 'турския', 'президент', 'ердоган', ',', 'който', 'поздрави', 'конференцията', 'на', 'дпс', '.', 'но', 'аз', 'мисля', ',', 'че', 'избирателите', 'на', 'дпс', 'са', 'свободни', 'български', 'граждани', '.', 'сигурно', 'ще', 'се', 'замислят', 'за', 'какво', 'отиват', 'гласовете', 'им', '.', 'това', 'каза', 'президентът', 'румен', 'радев', 'пред', 'журналисти', '.']","['логично', 'е', 'партията', 'на', 'гн', 'пеевски', 'дпс', 'да', 'подкрепи', 'борисов', 'за', 'президентските', 'изори', 'те', 'са', 'както', 'знаете', 'ортаци', 'в', 'бизнеса', 'и', 'политиката', 'още', 'повече', 'гн', 'борисов', 'е', 'довереното', 'лице', 'на', 'турския', 'президент', 'ердоган', 'който', 'поздрави', 'конференцията', 'на', 'дпс', 'но', 'аз', 'мисля', 'че', 'избирателите', 'на', 'дпс', 'са', 'свободни', 'български', 'граждани', 'сигурно', 'ще', 'се', 'замислят', 'за', 'какво', 'отиват', 'гласовете', 'им', 'това', 'каза', 'президентът', 'румен', 'радев', 'пред', 'журналисти']",28,10,0,0
борисов се готви за президент. такова опростачено управление не е имало от освобождението. това каза пред фрог нюз бившият депутат от герб и експредседател на комисията по досиетата методи андреев. ето какво още обясни той за сегашната политическа обстановка в страната:,5/1/2021 21:02,1673,201,157,frognews.bg,1,страната:,True,41,5.609756098,0,"['борисов', 'се', 'готви', 'за', 'президент', '.', 'такова', 'опростачено', 'управление', 'не', 'е', 'имало', 'от', 'освобождението', '.', 'това', 'каза', 'пред', 'фрог', 'нюз', 'бившият', 'депутат', 'от', 'герб', 'и', 'експредседател', 'на', 'комисията', 'по', 'досиетата', 'методи', 'андреев', '.', 'ето', 'какво', 'още', 'обясни', 'той', 'за', 'сегашната', 'политическа', 'обстановка', 'в', 'страната', ':']","['борисов', 'се', 'готви', 'за', 'президент', 'такова', 'опростачено', 'управление', 'не', 'е', 'имало', 'от', 'освобождението', 'това', 'каза', 'пред', 'фрог', 'нюз', 'бившият', 'депутат', 'от', 'герб', 'и', 'експредседател', 'на', 'комисията', 'по', 'досиетата', 'методи', 'андреев', 'ето', 'какво', 'още', 'обясни', 'той', 'за', 'сегашната', 'политическа', 'обстановка', 'в', 'страната']",18,4,0,0
"професор велислав минеков от „отровно трио” заяви, че се отказва да участва на предстоящите избори като кандидат за народен представител. и няма да се обвързва с политическа партия или гражданско сдружение.",5/1/2021 9:55,2430,86,207,frognews.bg,0,сдружение.,True,31,5.677419355,0,"['професор', 'велислав', 'минеков', 'от', '„', 'отровно', 'трио', '”', 'заяви', ',', 'че', 'се', 'отказва', 'да', 'участва', 'на', 'предстоящите', 'избори', 'като', 'кандидат', 'за', 'народен', 'представител', '.', 'и', 'няма', 'да', 'се', 'обвързва', 'с', 'политическа', 'партия', 'или', 'гражданско', 'сдружение', '.']","['професор', 'велислав', 'минеков', 'от', '', 'отровно', 'трио', '', 'заяви', 'че', 'се', 'отказва', 'да', 'участва', 'на', 'предстоящите', 'избори', 'като', 'кандидат', 'за', 'народен', 'представител', 'и', 'няма', 'да', 'се', 'обвързва', 'с', 'политическа', 'партия', 'или', 'гражданско', 'сдружение']",13,3,0,0
румен радев насрочи изборите,14-01-21 17:00,1056,73,443,Novini.bg,0,изборите,True,4,6.25,0,"['румен', 'радев', 'насрочи', 'изборите']","['румен', 'радев', 'насрочи', 'изборите']",0,0,0,0
"цветанов хвърли ""бомба"": имаше подмяна на вота, докато бях в герб",12/1/2021 19:30,1359,166,479,petel.bg,1,герб,True,11,5.0,1,"['цветанов', 'хвърли', '``', 'бомба', ""''"", ':', 'имаше', 'подмяна', 'на', 'вота', ',', 'докато', 'бях', 'в', 'герб']","['цветанов', 'хвърли', '', 'бомба', '', 'имаше', 'подмяна', 'на', 'вота', 'докато', 'бях', 'в', 'герб']",3,4,0,0
румен радев: броенето на гласовете трябва да се излъчва онлайн,9/1/2021 12:58,1751,59,221,petel.bg,0,онлайн,True,10,5.3,0,"['румен', 'радев', ':', 'броенето', 'на', 'гласовете', 'трябва', 'да', 'се', 'излъчва', 'онлайн']","['румен', 'радев', 'броенето', 'на', 'гласовете', 'трябва', 'да', 'се', 'излъчва', 'онлайн']",4,1,0,0
"тошко йорданов се появи пред президента с маска ""мутри вън!""",9/1/2021 11:11,1171,20,207,petel.bg,0,"вън!""",True,10,5.1,0,"['тошко', 'йорданов', 'се', 'появи', 'пред', 'президента', 'с', 'маска', '``', 'мутри', 'вън', '!', ""''""]","['тошко', 'йорданов', 'се', 'появи', 'пред', 'президента', 'с', 'маска', '', 'мутри', 'вън', '']",3,3,1,0
извънредно! акция в русе. има много арестувани полицаи. взимали са пари от,8/1/2021 12:06,681,76,166,petel.bg,1,от,False,12,5.25,1,"['извънредно', '!', 'акция', 'в', 'русе', '.', 'има', 'много', 'арестувани', 'полицаи', '.', 'взимали', 'са', 'пари', 'от']","['извънредно', 'акция', 'в', 'русе', 'има', 'много', 'арестувани', 'полицаи', 'взимали', 'са', 'пари', 'от']",5,3,1,0
президентът радев обяви: борисов и пеевски са ортаци. гласовете на дпс отиват за,6/1/2021 12:27,920,26,137,petel.bg,1,за,False,13,5.230769231,0,"['президентът', 'радев', 'обяви', ':', 'борисов', 'и', 'пеевски', 'са', 'ортаци', '.', 'гласовете', 'на', 'дпс', 'отиват', 'за']","['президентът', 'радев', 'обяви', 'борисов', 'и', 'пеевски', 'са', 'ортаци', 'гласовете', 'на', 'дпс', 'отиват', 'за']",4,2,0,0
"радан кънев: г-н борисов, 2020 г. беше провал. неадекватното ви поведение струва 15 хиляди живота за 2 месеца",4/1/2021 22:09,645,35,148,petel.bg,1,месеца,True,18,5.111111111,0,"['радан', 'кънев', ':', 'г-н', 'борисов', ',', '2020', 'г.', 'беше', 'провал', '.', 'неадекватното', 'ви', 'поведение', 'струва', '15', 'хиляди', 'живота', 'за', '2', 'месеца']","['радан', 'кънев', 'гн', 'борисов', '2020', 'г', 'беше', 'провал', 'неадекватното', 'ви', 'поведение', 'струва', '15', 'хиляди', 'живота', 'за', '2', 'месеца']",5,5,0,0
обявиха датата за връщане в клас. всички ученици обратно на училище от,4/1/2021 12:27,1563,234,206,petel.bg,0,от,False,12,4.916666667,0,"['обявиха', 'датата', 'за', 'връщане', 'в', 'клас', '.', 'всички', 'ученици', 'обратно', 'на', 'училище', 'от']","['обявиха', 'датата', 'за', 'връщане', 'в', 'клас', 'всички', 'ученици', 'обратно', 'на', 'училище', 'от']",5,1,0,0
идва люта зима. сняг над цяла българия и минус 20 градуса от,4/1/2021 9:22,2531,746,292,petel.bg,1,от,False,12,4.083333333,0,"['идва', 'люта', 'зима', '.', 'сняг', 'над', 'цяла', 'българия', 'и', 'минус', '20', 'градуса', 'от']","['идва', 'люта', 'зима', 'сняг', 'над', 'цяла', 'българия', 'и', 'минус', '20', 'градуса', 'от']",3,1,0,0
нов крупен обир. откраднаха 1 милион лева от къща в,3/1/2021 17:36,819,74,411,petel.bg,1,в,False,10,4.2,0,"['нов', 'крупен', 'обир', '.', 'откраднаха', '1', 'милион', 'лева', 'от', 'къща', 'в']","['нов', 'крупен', 'обир', 'откраднаха', '1', 'милион', 'лева', 'от', 'къща', 'в']",3,1,0,0
"голяма трагедия. шампион по гребане вдигна вила за 5 милиона лева, но почина без да поживее в нея",3/1/2021 15:20,686,98,179,petel.bg,1,нея,True,18,4.444444444,1,"['голяма', 'трагедия', '.', 'шампион', 'по', 'гребане', 'вдигна', 'вила', 'за', '5', 'милиона', 'лева', ',', 'но', 'почина', 'без', 'да', 'поживее', 'в', 'нея']","['голяма', 'трагедия', 'шампион', 'по', 'гребане', 'вдигна', 'вила', 'за', '5', 'милиона', 'лева', 'но', 'почина', 'без', 'да', 'поживее', 'в', 'нея']",7,2,0,0
"от днес минималната заплата се вдига с 40 лева, а най-ниските пенсии стават 300 лв.",1/1/2021 10:59,1942,320,354,petel.bg,0,лв.,True,15,4.6,0,"['от', 'днес', 'минималната', 'заплата', 'се', 'вдига', 'с', '40', 'лева', ',', 'а', 'най-ниските', 'пенсии', 'стават', '300', 'лв', '.']","['от', 'днес', 'минималната', 'заплата', 'се', 'вдига', 'с', '40', 'лева', 'а', 'найниските', 'пенсии', 'стават', '300', 'лв']",5,3,0,0
чудо на коледа. шумахер проходи,31-12-20 19:00,2322,54,136,petel.bg,1,проходи,True,5,5.4,0,"['чудо', 'на', 'коледа', '.', 'шумахер', 'проходи']","['чудо', 'на', 'коледа', 'шумахер', 'проходи']",1,1,0,0
"много тъжна вест! почина красивата гери гочева от ""огледала""",31-12-20 14:37,1334,58,822,petel.bg,1,"""огледала""",True,9,5.777777778,1,"['много', 'тъжна', 'вест', '!', 'почина', 'красивата', 'гери', 'гочева', 'от', '``', 'огледала', ""''""]","['много', 'тъжна', 'вест', 'почина', 'красивата', 'гери', 'гочева', 'от', '', 'огледала', '']",2,3,1,0
огромна трагедия! теле уби мъж на 42 години в свиленград. бутнало го е в,29-12-20 11:45,573,75,74,petel.bg,1,в,False,14,4.214285714,2,"['огромна', 'трагедия', '!', 'теле', 'уби', 'мъж', 'на', '42', 'години', 'в', 'свиленград', '.', 'бутнало', 'го', 'е', 'в']","['огромна', 'трагедия', 'теле', 'уби', 'мъж', 'на', '42', 'години', 'в', 'свиленград', 'бутнало', 'го', 'е', 'в']",6,2,1,0
мангъров часове след думите на борисов: няма да се ваксинирам,28-12-20 13:25,2196,109,321,petel.bg,0,ваксинирам,True,10,5.2,0,"['мангъров', 'часове', 'след', 'думите', 'на', 'борисов', ':', 'няма', 'да', 'се', 'ваксинирам']","['мангъров', 'часове', 'след', 'думите', 'на', 'борисов', 'няма', 'да', 'се', 'ваксинирам']",5,1,0,0
"вълчев: не сме във война, магазините са пълни, а вкъщи е топло",27-12-20 19:17,753,26,255,petel.bg,1,топло,True,12,4.25,0,"['вълчев', ':', 'не', 'сме', 'във', 'война', ',', 'магазините', 'са', 'пълни', ',', 'а', 'вкъщи', 'е', 'топло']","['вълчев', 'не', 'сме', 'във', 'война', 'магазините', 'са', 'пълни', 'а', 'вкъщи', 'е', 'топло']",6,3,0,0
фирмата собственик на бусовете за кренвирши: предоставяме ги безмъзмездно за транспорта на ваксините,26-12-20 20:13,767,44,324,petel.bg,0,ваксините,True,13,6.769230769,0,"['фирмата', 'собственик', 'на', 'бусовете', 'за', 'кренвирши', ':', 'предоставяме', 'ги', 'безмъзмездно', 'за', 'транспорта', 'на', 'ваксините']","['фирмата', 'собственик', 'на', 'бусовете', 'за', 'кренвирши', 'предоставяме', 'ги', 'безмъзмездно', 'за', 'транспорта', 'на', 'ваксините']",5,1,0,0
