post_text,time,likes,shares,comments,src,fake_status,last_word,finalized,words,avg_word_length,urgent_words,post_text_tokens,final_words,stop_words,marks,exclamation_marks,Cluster
румен радев съобщи датата на изборите,14-01-21 17:12,861,19,104,petel.bg,0,изборите,True,6,5.333333333,0,"['румен', 'радев', 'съобщи', 'датата', 'на', 'изборите']","['румен', 'радев', 'съобщи', 'датата', 'на', 'изборите']",1,0,0,0
"цветанов хвърли ""бомба"": имаше подмяна на вота, докато бях в герб",12/1/2021 19:30,1359,166,479,petel.bg,1,герб,True,11,5.0,1,"['цветанов', 'хвърли', '``', 'бомба', ""''"", ':', 'имаше', 'подмяна', 'на', 'вота', ',', 'докато', 'бях', 'в', 'герб']","['цветанов', 'хвърли', '', 'бомба', '', 'имаше', 'подмяна', 'на', 'вота', 'докато', 'бях', 'в', 'герб']",3,4,0,0
румен радев: броенето на гласовете трябва да се излъчва онлайн,9/1/2021 12:58,1751,59,221,petel.bg,0,онлайн,True,10,5.3,0,"['румен', 'радев', ':', 'броенето', 'на', 'гласовете', 'трябва', 'да', 'се', 'излъчва', 'онлайн']","['румен', 'радев', 'броенето', 'на', 'гласовете', 'трябва', 'да', 'се', 'излъчва', 'онлайн']",4,1,0,0
"тошко йорданов се появи пред президента с маска ""мутри вън!""",9/1/2021 11:11,1171,20,207,petel.bg,0,"вън!""",True,10,5.1,0,"['тошко', 'йорданов', 'се', 'появи', 'пред', 'президента', 'с', 'маска', '``', 'мутри', 'вън', '!', ""''""]","['тошко', 'йорданов', 'се', 'появи', 'пред', 'президента', 'с', 'маска', '', 'мутри', 'вън', '']",3,3,1,0
��недоволните искат оставка на правителството и главния прокурор👇,13-01-21 21:51,1122,43,34,mediapool.,0,прокурор👇,True,8,7.125,0,"['👉недоволните', 'искат', 'оставка', 'на', 'правителството', 'и', 'главния', 'прокурор👇']","['недоволните', 'искат', 'оставка', 'на', 'правителството', 'и', 'главния', 'прокурор']",2,0,0,0
"президентът румен радев се срещна с ""демократична българия"", ""има такъв народ"", ""изправи се. бг"" и ""отровното трио""",9/1/2021 15:16,1849,80,159,mediapool.,0,"трио""",True,17,5.823529412,0,"['президентът', 'румен', 'радев', 'се', 'срещна', 'с', '``', 'демократична', 'българия', ""''"", ',', '``', 'има', 'такъв', 'народ', ""''"", ',', '``', 'изправи', 'се', '.', 'бг', ""''"", 'и', '``', 'отровното', 'трио', ""''""]","['президентът', 'румен', 'радев', 'се', 'срещна', 'с', '', 'демократична', 'българия', '', '', 'има', 'такъв', 'народ', '', '', 'изправи', 'се', 'бг', '', 'и', '', 'отровното', 'трио', '']",6,11,0,0
‼мон принуди ректорите спешно да актуализират учебните си програми.,7/1/2021 17:42,889,139,89,mediapool.,0,програми.,True,9,6.555555556,0,"['‼мон', 'принуди', 'ректорите', 'спешно', 'да', 'актуализират', 'учебните', 'си', 'програми', '.']","['мон', 'принуди', 'ректорите', 'спешно', 'да', 'актуализират', 'учебните', 'си', 'програми']",2,1,0,0
"""глобата, която трябва да отнеса, нека бъде само за мен. личи си, че е обществено значимо нашето хоро"".",7/1/2021 12:22,677,4,38,mediapool.,0,"хоро"".",True,18,4.777777778,0,"['``', 'глобата', ',', 'която', 'трябва', 'да', 'отнеса', ',', 'нека', 'бъде', 'само', 'за', 'мен', '.', 'личи', 'си', ',', 'че', 'е', 'обществено', 'значимо', 'нашето', 'хоро', ""''"", '.']","['', 'глобата', 'която', 'трябва', 'да', 'отнеса', 'нека', 'бъде', 'само', 'за', 'мен', 'личи', 'си', 'че', 'е', 'обществено', 'значимо', 'нашето', 'хоро', '']",10,7,0,0
"юри ратас подаде оставка, въпреки че няма доказателства той да е участвал в схемата. по разследването за предоставяне на държавен заем на частен строителен проект бяха задържани четирима души от партията на премиера.",13-01-21 12:51,546,84,57,svobodnaev,0,премиера.,True,33,5.575757576,0,"['юри', 'ратас', 'подаде', 'оставка', ',', 'въпреки', 'че', 'няма', 'доказателства', 'той', 'да', 'е', 'участвал', 'в', 'схемата', '.', 'по', 'разследването', 'за', 'предоставяне', 'на', 'държавен', 'заем', 'на', 'частен', 'строителен', 'проект', 'бяха', 'задържани', 'четирима', 'души', 'от', 'партията', 'на', 'премиера', '.']","['юри', 'ратас', 'подаде', 'оставка', 'въпреки', 'че', 'няма', 'доказателства', 'той', 'да', 'е', 'участвал', 'в', 'схемата', 'по', 'разследването', 'за', 'предоставяне', 'на', 'държавен', 'заем', 'на', 'частен', 'строителен', 'проект', 'бяха', 'задържани', 'четирима', 'души', 'от', 'партията', 'на', 'премиера']",14,3,0,0
"при температури от минус 40 градуса по целзий единствените, които остават през зимата в село тумул в сибирския регион якутия, са местните фермери и семействата им. припомняме ви това видео от преди година.",11/1/2021 21:29,570,0,5,svobodnaev,0,година.,True,33,5.242424242,0,"['при', 'температури', 'от', 'минус', '40', 'градуса', 'по', 'целзий', 'единствените', ',', 'които', 'остават', 'през', 'зимата', 'в', 'село', 'тумул', 'в', 'сибирския', 'регион', 'якутия', ',', 'са', 'местните', 'фермери', 'и', 'семействата', 'им', '.', 'припомняме', 'ви', 'това', 'видео', 'от', 'преди', 'година', '.']","['при', 'температури', 'от', 'минус', '40', 'градуса', 'по', 'целзий', 'единствените', 'които', 'остават', 'през', 'зимата', 'в', 'село', 'тумул', 'в', 'сибирския', 'регион', 'якутия', 'са', 'местните', 'фермери', 'и', 'семействата', 'им', 'припомняме', 'ви', 'това', 'видео', 'от', 'преди', 'година']",15,4,0,0
"мария бакалова, която впечатли американската кинокритика с ролята си в “борат 2”, е човек на деня на свободна европа.",11/1/2021 19:29,905,47,28,svobodnaev,0,европа.,True,19,5.210526316,0,"['мария', 'бакалова', ',', 'която', 'впечатли', 'американската', 'кинокритика', 'с', 'ролята', 'си', 'в', '“', 'борат', '2', '”', ',', 'е', 'човек', 'на', 'деня', 'на', 'свободна', 'европа', '.']","['мария', 'бакалова', 'която', 'впечатли', 'американската', 'кинокритика', 'с', 'ролята', 'си', 'в', '', 'борат', '2', '', 'е', 'човек', 'на', 'деня', 'на', 'свободна', 'европа']",7,3,0,0
“не можем повече да го отлагаме”. президентът румен радев се срещна онлайн с представители на българската диаспора в чужбина. българите се обединиха около искането за дистанционно гласуване.,11/1/2021 17:50,1872,101,100,svobodnaev,0,гласуване.,True,27,6.074074074,0,"['“', 'не', 'можем', 'повече', 'да', 'го', 'отлагаме', '”', '.', 'президентът', 'румен', 'радев', 'се', 'срещна', 'онлайн', 'с', 'представители', 'на', 'българската', 'диаспора', 'в', 'чужбина', '.', 'българите', 'се', 'обединиха', 'около', 'искането', 'за', 'дистанционно', 'гласуване', '.']","['', 'не', 'можем', 'повече', 'да', 'го', 'отлагаме', '', 'президентът', 'румен', 'радев', 'се', 'срещна', 'онлайн', 'с', 'представители', 'на', 'българската', 'диаспора', 'в', 'чужбина', 'българите', 'се', 'обединиха', 'около', 'искането', 'за', 'дистанционно', 'гласуване']",11,3,0,0
"в началото на 2021 година изглежда по ""турски поток"" вече минава руски газ, но нито има откриване, нито има отговор на въпроса готов ли е изобщо проектът. официални отговори няма. елица симеонова разказва.",11/1/2021 9:25,849,230,88,svobodnaev,0,разказва.,True,33,5.242424242,0,"['в', 'началото', 'на', '2021', 'година', 'изглежда', 'по', '``', 'турски', 'поток', ""''"", 'вече', 'минава', 'руски', 'газ', ',', 'но', 'нито', 'има', 'откриване', ',', 'нито', 'има', 'отговор', 'на', 'въпроса', 'готов', 'ли', 'е', 'изобщо', 'проектът', '.', 'официални', 'отговори', 'няма', '.', 'елица', 'симеонова', 'разказва', '.']","['в', 'началото', 'на', '2021', 'година', 'изглежда', 'по', '', 'турски', 'поток', '', 'вече', 'минава', 'руски', 'газ', 'но', 'нито', 'има', 'откриване', 'нито', 'има', 'отговор', 'на', 'въпроса', 'готов', 'ли', 'е', 'изобщо', 'проектът', 'официални', 'отговори', 'няма', 'елица', 'симеонова', 'разказва']",14,7,0,0
"профилът на тръмп вече не съществува. чрез него президентът обявяваше политики, воюваше с опоненти, разпространяваше информация и дезинформация, дори уволняваше хора.",9/1/2021 16:10,1049,69,232,svobodnaev,0,хора.,True,21,6.952380952,0,"['профилът', 'на', 'тръмп', 'вече', 'не', 'съществува', '.', 'чрез', 'него', 'президентът', 'обявяваше', 'политики', ',', 'воюваше', 'с', 'опоненти', ',', 'разпространяваше', 'информация', 'и', 'дезинформация', ',', 'дори', 'уволняваше', 'хора', '.']","['профилът', 'на', 'тръмп', 'вече', 'не', 'съществува', 'чрез', 'него', 'президентът', 'обявяваше', 'политики', 'воюваше', 'с', 'опоненти', 'разпространяваше', 'информация', 'и', 'дезинформация', 'дори', 'уволняваше', 'хора']",8,5,0,0
"извънпарламентарните партии бяха поотделно на консултации при президента радев. те казаха едно и също нещо: че не вярват в честността на избори, провеждани от герб. от ""демократична българия"" предложиха няколко конкретни мерки, които да намалят риска от манипулации.",9/1/2021 14:00,2648,130,255,svobodnaev,0,манипулации.,True,38,6.026315789,0,"['извънпарламентарните', 'партии', 'бяха', 'поотделно', 'на', 'консултации', 'при', 'президента', 'радев', '.', 'те', 'казаха', 'едно', 'и', 'също', 'нещо', ':', 'че', 'не', 'вярват', 'в', 'честността', 'на', 'избори', ',', 'провеждани', 'от', 'герб', '.', 'от', '``', 'демократична', 'българия', ""''"", 'предложиха', 'няколко', 'конкретни', 'мерки', ',', 'които', 'да', 'намалят', 'риска', 'от', 'манипулации', '.']","['извънпарламентарните', 'партии', 'бяха', 'поотделно', 'на', 'консултации', 'при', 'президента', 'радев', 'те', 'казаха', 'едно', 'и', 'също', 'нещо', 'че', 'не', 'вярват', 'в', 'честността', 'на', 'избори', 'провеждани', 'от', 'герб', 'от', '', 'демократична', 'българия', '', 'предложиха', 'няколко', 'конкретни', 'мерки', 'които', 'да', 'намалят', 'риска', 'от', 'манипулации']",18,8,0,0
"след погрома на ктб отношенията борисов-пеевски станаха ”союз нерошимый”. министерството на икономиката е запазена територия за пеевски, известно е за божидар лукарски. публична тайна е, че пеевски взе на концесия квотата на волен сидеров. министър караниколов защитаваше интересите на певски. същият е и сегашният министър лъчезар борисов, има връзки с пеевски от 2008 г. няма какво да споменавам горанов. това каза банкерът цветан василев, бивш мажоритарен собственик на ктб.",13-01-21 20:56,671,173,24,frognews.bg,0,ктб.,True,69,5.927536232,0,"['след', 'погрома', 'на', 'ктб', 'отношенията', 'борисов-пеевски', 'станаха', '”', 'союз', 'нерошимый', '”', '.', 'министерството', 'на', 'икономиката', 'е', 'запазена', 'територия', 'за', 'пеевски', ',', 'известно', 'е', 'за', 'божидар', 'лукарски', '.', 'публична', 'тайна', 'е', ',', 'че', 'пеевски', 'взе', 'на', 'концесия', 'квотата', 'на', 'волен', 'сидеров', '.', 'министър', 'караниколов', 'защитаваше', 'интересите', 'на', 'певски', '.', 'същият', 'е', 'и', 'сегашният', 'министър', 'лъчезар', 'борисов', ',', 'има', 'връзки', 'с', 'пеевски', 'от', '2008', 'г.', 'няма', 'какво', 'да', 'споменавам', 'горанов', '.', 'това', 'каза', 'банкерът', 'цветан', 'василев', ',', 'бивш', 'мажоритарен', 'собственик', 'на', 'ктб', '.']","['след', 'погрома', 'на', 'ктб', 'отношенията', 'борисовпеевски', 'станаха', '', 'союз', 'нерошимый', '', 'министерството', 'на', 'икономиката', 'е', 'запазена', 'територия', 'за', 'пеевски', 'известно', 'е', 'за', 'божидар', 'лукарски', 'публична', 'тайна', 'е', 'че', 'пеевски', 'взе', 'на', 'концесия', 'квотата', 'на', 'волен', 'сидеров', 'министър', 'караниколов', 'защитаваше', 'интересите', 'на', 'певски', 'същият', 'е', 'и', 'сегашният', 'министър', 'лъчезар', 'борисов', 'има', 'връзки', 'с', 'пеевски', 'от', '2008', 'г', 'няма', 'какво', 'да', 'споменавам', 'горанов', 'това', 'каза', 'банкерът', 'цветан', 'василев', 'бивш', 'мажоритарен', 'собственик', 'на', 'ктб']",25,12,0,0
"ортаците -преди и сега. за общото между борисов и пеевски ще разкаже, както никой досега, бившият мажоритарен собственик на ктб цветан василев.",13-01-21 15:17,1338,179,40,frognews.bg,0,василев.,True,22,5.545454545,0,"['ортаците', '-преди', 'и', 'сега', '.', 'за', 'общото', 'между', 'борисов', 'и', 'пеевски', 'ще', 'разкаже', ',', 'както', 'никой', 'досега', ',', 'бившият', 'мажоритарен', 'собственик', 'на', 'ктб', 'цветан', 'василев', '.']","['ортаците', 'преди', 'и', 'сега', 'за', 'общото', 'между', 'борисов', 'и', 'пеевски', 'ще', 'разкаже', 'както', 'никой', 'досега', 'бившият', 'мажоритарен', 'собственик', 'на', 'ктб', 'цветан', 'василев']",11,5,0,0
днес започва най-големият процес срещу мафията през последните десетилетия. пред съда в италия ще се изправят 355 предполагаеми членове на могъщата мафиотска група ндрангета. над хиляда адвоката и още толкова експерти са ангажирани в наричания „процес на века“.,13-01-21 9:16,1819,403,86,frognews.bg,0,века“.,True,38,5.894736842,0,"['днес', 'започва', 'най-големият', 'процес', 'срещу', 'мафията', 'през', 'последните', 'десетилетия', '.', 'пред', 'съда', 'в', 'италия', 'ще', 'се', 'изправят', '355', 'предполагаеми', 'членове', 'на', 'могъщата', 'мафиотска', 'група', 'ндрангета', '.', 'над', 'хиляда', 'адвоката', 'и', 'още', 'толкова', 'експерти', 'са', 'ангажирани', 'в', 'наричания', '„', 'процес', 'на', 'века', '“', '.']","['днес', 'започва', 'найголемият', 'процес', 'срещу', 'мафията', 'през', 'последните', 'десетилетия', 'пред', 'съда', 'в', 'италия', 'ще', 'се', 'изправят', '355', 'предполагаеми', 'членове', 'на', 'могъщата', 'мафиотска', 'група', 'ндрангета', 'над', 'хиляда', 'адвоката', 'и', 'още', 'толкова', 'експерти', 'са', 'ангажирани', 'в', 'наричания', '', 'процес', 'на', 'века', '']",15,4,0,0
"”при наличието на обвинители като цацаров и гешев, формалната част на „неформалното” им партньорство ще остане скрита. но само в българия, защото финансовото „съвкупление” на „скромните политици” борисов и пеевски е известно на този, който трябва да знае”, коментира цветан василев пред liberta.bg.",9/1/2021 14:24,2450,262,50,frognews.bg,0,liberta.bg.,True,43,5.953488372,0,"['”', 'при', 'наличието', 'на', 'обвинители', 'като', 'цацаров', 'и', 'гешев', ',', 'формалната', 'част', 'на', '„', 'неформалното', '”', 'им', 'партньорство', 'ще', 'остане', 'скрита', '.', 'но', 'само', 'в', 'българия', ',', 'защото', 'финансовото', '„', 'съвкупление', '”', 'на', '„', 'скромните', 'политици', '”', 'борисов', 'и', 'пеевски', 'е', 'известно', 'на', 'този', ',', 'който', 'трябва', 'да', 'знае', '”', ',', 'коментира', 'цветан', 'василев', 'пред', 'liberta.bg', '.']","['', 'при', 'наличието', 'на', 'обвинители', 'като', 'цацаров', 'и', 'гешев', 'формалната', 'част', 'на', '', 'неформалното', '', 'им', 'партньорство', 'ще', 'остане', 'скрита', 'но', 'само', 'в', 'българия', 'защото', 'финансовото', '', 'съвкупление', '', 'на', '', 'скромните', 'политици', '', 'борисов', 'и', 'пеевски', 'е', 'известно', 'на', 'този', 'който', 'трябва', 'да', 'знае', '', 'коментира', 'цветан', 'василев', 'пред', 'libertabg']",20,7,0,0
"борисов отдавна има проблем с журналистите, защото не може да даде отговор на много въпроси, които се натрупаха. това обясни журналистът спас спасов по повод „дупката“ във варна. той посочи, че при последното посещение на премиера в града не е имало журналисти, а само камерите, които пресъздават виртуалната реалност, в която той съществува. журналистът допълни, че на борисов му пречи демокрацията и иска да се изолира.",9/1/2021 10:45,2629,250,121,frognews.bg,0,изолира.,True,66,5.393939394,0,"['борисов', 'отдавна', 'има', 'проблем', 'с', 'журналистите', ',', 'защото', 'не', 'може', 'да', 'даде', 'отговор', 'на', 'много', 'въпроси', ',', 'които', 'се', 'натрупаха', '.', 'това', 'обясни', 'журналистът', 'спас', 'спасов', 'по', 'повод', '„', 'дупката', '“', 'във', 'варна', '.', 'той', 'посочи', ',', 'че', 'при', 'последното', 'посещение', 'на', 'премиера', 'в', 'града', 'не', 'е', 'имало', 'журналисти', ',', 'а', 'само', 'камерите', ',', 'които', 'пресъздават', 'виртуалната', 'реалност', ',', 'в', 'която', 'той', 'съществува', '.', 'журналистът', 'допълни', ',', 'че', 'на', 'борисов', 'му', 'пречи', 'демокрацията', 'и', 'иска', 'да', 'се', 'изолира', '.']","['борисов', 'отдавна', 'има', 'проблем', 'с', 'журналистите', 'защото', 'не', 'може', 'да', 'даде', 'отговор', 'на', 'много', 'въпроси', 'които', 'се', 'натрупаха', 'това', 'обясни', 'журналистът', 'спас', 'спасов', 'по', 'повод', '', 'дупката', '', 'във', 'варна', 'той', 'посочи', 'че', 'при', 'последното', 'посещение', 'на', 'премиера', 'в', 'града', 'не', 'е', 'имало', 'журналисти', 'а', 'само', 'камерите', 'които', 'пресъздават', 'виртуалната', 'реалност', 'в', 'която', 'той', 'съществува', 'журналистът', 'допълни', 'че', 'на', 'борисов', 'му', 'пречи', 'демокрацията', 'и', 'иска', 'да', 'се', 'изолира']",33,11,0,0
